<?xml version='1.0' encoding='utf-8'?>
<!--
  容器随镜像分发的样例配置：只在挂载的 BAS_HOME 里没有 conf/server.xml 时铺一份。

  与宿主用的样例（仓库根的 server.xml）的区别只有两处：

  1. `<setline port="10080"/>` 声明 basctl 要推路由的**管理口端口**（写接口只在管理口上、且只认
     回环来的连接）；hostname 省略时使用 `*`，匹配任意 Host。setline 进程由入口脚本自己拉起，
     它自己那份配置
     （`listen` 缺省 `*:8080`、`adminListen` 缺省 `127.0.0.1:10080`）也由入口脚本写进
     `conf/setline.json`——basctl 只推路由，不生成 setline 的配置。入口脚本铺这份样例时会按
     `BAS_SETLINE_ADMIN_LISTEN` 的端口改写这里的 port；
  2. `<server http="0"/>`：端口交给 basctl 在容器内动态分配（缺省 20000-29999），
     容器只需要 publish 8080 这一个端口——这就是「一机器一出口」。
-->
<bas xmlns:xsi="http://www.w3.org/2001/XMLSchema-instance"
     xsi:noNamespaceSchemaLocation="http://beangle.github.io/schema/bas-1.0.0.xsd"
     version="0.14.0">
  <repository remote="https://maven.aliyun.com/repository/public"/>

  <setline port="10080"/>

  <engines>
    <engine name="tomcat" type="tomcat-server" version="11.0.26"/>
  </engines>

  <farms>
    <farm name="sample" engine="tomcat" max-heap-size="256m">
      <server-options>-Duser.timezone=Asia/Shanghai</server-options>
      <server name="server1" http="0"/>
    </farm>
  </farms>

  <webapps>
    <webapp name="otk" uri="gav://org.beangle.otk:beangle-otk-ws:war:0.0.30" run-at="sample" path="/tools"/>
  </webapps>
</bas>
